{
  "$schema": "https://json-schema.org/draft/2020-12/schema",
  "title": "capability.json (output, v1)",
  "type": "object",
  "additionalProperties": false,
  "required": [
    "schema_version",
    "profile_id",
    "person",
    "generated_at",
    "tiers",
    "skills",
    "cards"
  ],
  "properties": {
    "schema_version": {
      "const": "1.0"
    },
    "profile_id": {
      "type": "string",
      "pattern": "^[a-z0-9][a-z0-9-]{0,60}$"
    },
    "person": {
      "type": "object",
      "required": [
        "name",
        "short_name"
      ],
      "properties": {
        "name": {
          "type": "string",
          "minLength": 1
        },
        "short_name": {
          "type": "string",
          "minLength": 1
        }
      }
    },
    "generated_at": {
      "type": "string",
      "minLength": 1
    },
    "sources": {
      "type": "object"
    },
    "tiers": {
      "type": "array",
      "minItems": 3,
      "maxItems": 6,
      "items": {
        "type": "object",
        "required": [
          "level",
          "universal",
          "label"
        ],
        "properties": {
          "level": {
            "type": "integer"
          },
          "universal": {
            "type": "string",
            "minLength": 1
          },
          "label": {
            "type": "string",
            "minLength": 1
          },
          "computed": {
            "type": "boolean"
          }
        }
      }
    },
    "skills": {
      "type": "array",
      "items": {
        "type": "object",
        "additionalProperties": false,
        "required": [
          "id",
          "name",
          "tier",
          "evidence",
          "projects_by_tier",
          "first_evidence"
        ],
        "properties": {
          "id": {
            "type": "string",
            "pattern": "^[a-z0-9][a-z0-9-]{0,60}$"
          },
          "name": {
            "type": "string",
            "minLength": 1
          },
          "esco_uri": {
            "type": "string"
          },
          "match": {
            "type": "array"
          },
          "tier": {
            "type": "integer",
            "minimum": 0,
            "maximum": 6
          },
          "first_evidence": {
            "type": [
              "string",
              "null"
            ]
          },
          "projects_by_tier": {
            "type": "object"
          },
          "evidence": {
            "type": "array",
            "items": {
              "type": "object",
              "additionalProperties": false,
              "required": [
                "tier",
                "repo",
                "path",
                "heading",
                "url",
                "quote",
                "source_type",
                "verified_by"
              ],
              "properties": {
                "tier": {
                  "type": "integer",
                  "minimum": 1,
                  "maximum": 6
                },
                "repo": {
                  "type": "string",
                  "minLength": 1
                },
                "path": {
                  "type": "string",
                  "minLength": 1
                },
                "heading": {
                  "type": "string"
                },
                "url": {
                  "type": "string",
                  "pattern": "^https://"
                },
                "quote": {
                  "type": "string",
                  "minLength": 1
                },
                "project": {
                  "type": "string"
                },
                "source_type": {
                  "enum": [
                    "github_readme"
                  ]
                },
                "verified_by": {
                  "enum": [
                    "self",
                    "third_party"
                  ]
                },
                "first_committed": {
                  "type": [
                    "string",
                    "null"
                  ]
                },
                "kind": {
                  "type": "string"
                }
              }
            }
          },
          "depth": {
            "type": "object",
            "additionalProperties": false,
            "required": [
              "projects_at_top",
              "months",
              "third_party"
            ],
            "properties": {
              "projects_at_top": {
                "type": "array",
                "items": {
                  "type": "string"
                }
              },
              "months": {
                "type": [
                  "integer",
                  "null"
                ]
              },
              "third_party": {
                "type": "boolean"
              },
              "reached": {
                "type": "boolean"
              }
            }
          }
        }
      }
    },
    "cards": {
      "type": "array",
      "items": {
        "type": "object",
        "additionalProperties": false,
        "required": [
          "id",
          "title",
          "stories",
          "gap"
        ],
        "properties": {
          "id": {
            "type": "string",
            "pattern": "^[a-z0-9][a-z0-9-]{0,60}$"
          },
          "title": {
            "type": "string",
            "minLength": 1
          },
          "gap": {
            "type": "boolean"
          },
          "gap_note": {
            "type": "string"
          },
          "stories": {
            "type": "array",
            "items": {
              "type": "object",
              "additionalProperties": false,
              "required": [
                "id",
                "title",
                "summary",
                "repo",
                "path",
                "heading",
                "url",
                "quote",
                "source_type",
                "verified_by"
              ],
              "properties": {
                "id": {
                  "type": "string",
                  "minLength": 1
                },
                "title": {
                  "type": "string",
                  "minLength": 1
                },
                "summary": {
                  "type": "string",
                  "minLength": 1
                },
                "repo": {
                  "type": "string",
                  "minLength": 1
                },
                "path": {
                  "type": "string",
                  "minLength": 1
                },
                "heading": {
                  "type": "string"
                },
                "url": {
                  "type": "string",
                  "pattern": "^https://"
                },
                "quote": {
                  "type": "string",
                  "minLength": 1
                },
                "project": {
                  "type": "string"
                },
                "source_type": {
                  "enum": [
                    "github_readme"
                  ]
                },
                "verified_by": {
                  "enum": [
                    "self",
                    "third_party"
                  ]
                }
              }
            }
          }
        }
      }
    },
    "plans": {
      "type": "array",
      "items": {
        "type": "object",
        "additionalProperties": false,
        "required": [
          "id",
          "name",
          "work",
          "planned",
          "target",
          "status"
        ],
        "properties": {
          "id": {
            "type": "string"
          },
          "skill": {
            "type": "string"
          },
          "card": {
            "type": "string"
          },
          "name": {
            "type": "string"
          },
          "work": {
            "type": "string"
          },
          "target_tier": {
            "type": "integer",
            "minimum": 1,
            "maximum": 6
          },
          "target_label": {
            "type": "string"
          },
          "planned": {
            "type": "string",
            "pattern": "^20[0-9]{2}-(0[1-9]|1[0-2])$"
          },
          "target": {
            "type": "string",
            "pattern": "^20[0-9]{2}-(0[1-9]|1[0-2])$"
          },
          "status": {
            "enum": [
              "open",
              "overdue",
              "closed"
            ]
          },
          "closed": {
            "type": "string",
            "pattern": "^20[0-9]{2}-(0[1-9]|1[0-2])$"
          },
          "on_time": {
            "type": "boolean"
          }
        }
      }
    },
    "plan_record": {
      "type": "object",
      "additionalProperties": false,
      "required": [
        "total",
        "closed",
        "on_time",
        "open",
        "overdue"
      ],
      "properties": {
        "total": {
          "type": "integer",
          "minimum": 0
        },
        "closed": {
          "type": "integer",
          "minimum": 0
        },
        "on_time": {
          "type": "integer",
          "minimum": 0
        },
        "open": {
          "type": "integer",
          "minimum": 0
        },
        "overdue": {
          "type": "integer",
          "minimum": 0
        }
      }
    }
  }
}
