{
  "schema_version": "1.0",
  "profile_id": "barry-sisk",
  "person": {
    "name": "Barry Sisk",
    "short_name": "Barry"
  },
  "generated_at": "2026-11-01T10:36:22Z",
  "sources": {
    "repos": [
      "BBSISK",
      "CS385_Mobile_App",
      "CS627_Advanced_OOP_Java",
      "PlanForMe",
      "SECOM_Pipeline",
      "agentmath_showcase",
      "ask-barry",
      "dice-roll-api",
      "housing-pipeline-ireland",
      "inmytime-showcase",
      "leetcode-java",
      "my30words_showcase",
      "react-challenges",
      "wall_inspector"
    ]
  },
  "tiers": [
    {
      "level": 1,
      "universal": "Learned",
      "label": "Used"
    },
    {
      "level": 2,
      "universal": "Applied",
      "label": "Built"
    },
    {
      "level": 3,
      "universal": "Delivered",
      "label": "In production"
    },
    {
      "level": 4,
      "universal": "Proven",
      "label": "Tested / evaluated"
    },
    {
      "level": 5,
      "universal": "Sustained",
      "label": "Proven over time",
      "computed": true
    }
  ],
  "skills": [
    {
      "id": "python-flask",
      "name": "Python & Flask",
      "tier": 4,
      "first_evidence": "2026-09",
      "projects_by_tier": {
        "1": [
          "AgentMath",
          "Ask Barry",
          "Brief",
          "Housing Pipeline Ireland",
          "In My Time",
          "PlanForMe"
        ],
        "2": [
          "Ask Barry",
          "In My Time",
          "PlanForMe"
        ],
        "3": [
          "Ask Barry",
          "In My Time"
        ],
        "4": [
          "Ask Barry"
        ]
      },
      "evidence": [
        {
          "tier": 4,
          "repo": "ask-barry",
          "path": "README.md",
          "heading": "Ask Barry > Deployment",
          "url": "https://github.com/BBSISK/ask-barry/blob/2ded33495b4565c913446dd60aa3884119a90161/README.md#deployment",
          "project": "Ask Barry",
          "source_type": "github_readme",
          "verified_by": "self",
          "quote": "Ask Barry is a Flask app running in production on Render... CI runs the full pytest suite on every push. It includes tests that call the Flask routes... so a broken route blocks the deploy.",
          "kind": "application",
          "first_committed": "2026-09-27"
        },
        {
          "tier": 3,
          "repo": "ask-barry",
          "path": "README.md",
          "heading": "Ask Barry > Run locally",
          "url": "https://github.com/BBSISK/ask-barry/blob/2ded33495b4565c913446dd60aa3884119a90161/README.md#run-locally",
          "project": "Ask Barry",
          "source_type": "github_readme",
          "verified_by": "self",
          "quote": "flask --app wsgi run # open http://127.0.0.1:5000",
          "kind": "application",
          "first_committed": "2026-09-27"
        },
        {
          "tier": 3,
          "repo": "inmytime-showcase",
          "path": "README.md",
          "heading": "🌸 In My Time > Technical highlights > Architecture and engineering",
          "url": "https://github.com/BBSISK/inmytime-showcase/blob/20b4e236107423a2824fdb8d7083e73c8016e769/README.md#architecture-and-engineering",
          "project": "In My Time",
          "source_type": "github_readme",
          "verified_by": "self",
          "quote": "One Flask app with a blueprint pair per product (page routes plus a JSON API), each with its own schema module and no cross-module foreign keys",
          "kind": "application",
          "first_committed": "2026-09-25"
        },
        {
          "tier": 2,
          "repo": "PlanForMe",
          "path": "README.md",
          "heading": "PlanForMe > Run locally (Mac)",
          "url": "https://github.com/BBSISK/PlanForMe/blob/8ac82839add2189853ef0adff57c2e392a6023d8/README.md#run-locally-mac",
          "project": "PlanForMe",
          "source_type": "github_readme",
          "verified_by": "self",
          "quote": "python app.py # http://localhost:5000 (seeds demo modules on first run) python -m pytest -q # 7 tests",
          "kind": "practice",
          "first_committed": "2026-10-14"
        },
        {
          "tier": 2,
          "repo": "inmytime-showcase",
          "path": "README.md",
          "heading": "🌸 In My Time > Technical highlights > The project by the numbers",
          "url": "https://github.com/BBSISK/inmytime-showcase/blob/20b4e236107423a2824fdb8d7083e73c8016e769/README.md#the-project-by-the-numbers",
          "project": "In My Time",
          "source_type": "github_readme",
          "verified_by": "self",
          "quote": "around 340 commits, roughly 22,000 lines of Python, 57 page templates, 200+ routes across four schema modules, and dozens of database tables.",
          "kind": "application",
          "first_committed": "2026-09-25"
        },
        {
          "tier": 1,
          "repo": "my30words_showcase",
          "path": "README.md",
          "heading": "✍️ Brief > Tech stack",
          "url": "https://github.com/BBSISK/my30words_showcase/blob/59ea4492dc89a13dd7b91003a74c24252bbeaedd/README.md#tech-stack",
          "project": "Brief",
          "source_type": "github_readme",
          "verified_by": "self",
          "quote": "| Backend | Python, Flask, scheduled jobs |",
          "kind": "application",
          "first_committed": "2026-09-25"
        },
        {
          "tier": 1,
          "repo": "housing-pipeline-ireland",
          "path": "README.md",
          "heading": "Housing Pipeline Ireland > Run the tests",
          "url": "https://github.com/BBSISK/housing-pipeline-ireland/blob/6e9e1fe07c4266efc29405b6511be6bd7aba6adb/README.md#run-the-tests",
          "project": "Housing Pipeline Ireland",
          "source_type": "github_readme",
          "verified_by": "self",
          "quote": "python3 -m venv .venv source .venv/bin/activate python -m pip install -e \".[dev]\" python -m pytest -q",
          "kind": "application",
          "first_committed": "2026-10-08"
        },
        {
          "tier": 1,
          "repo": "agentmath_showcase",
          "path": "README.md",
          "heading": "🕵️ AgentMath > Tech stack",
          "url": "https://github.com/BBSISK/agentmath_showcase/blob/82a07515adb2d9e5f92f0d7250eae6f81c1c6c59/README.md#tech-stack",
          "project": "AgentMath",
          "source_type": "github_readme",
          "verified_by": "self",
          "quote": "| Backend | Python, Flask |",
          "kind": "application",
          "first_committed": "2026-09-25"
        }
      ],
      "depth": {
        "projects_at_top": [
          "Ask Barry"
        ],
        "months": 2,
        "third_party": false,
        "reached": false
      },
      "match": [
        "python",
        "flask",
        "django",
        "fastapi",
        "back end",
        "backend"
      ]
    },
    {
      "id": "cloud",
      "name": "Cloud (Azure & AWS)",
      "tier": 4,
      "first_evidence": "2026-09",
      "projects_by_tier": {
        "1": [
          "Ask Barry",
          "SECOM Pipeline",
          "cs210-playlist-lambda",
          "dice-roll-api"
        ],
        "2": [
          "Ask Barry",
          "SECOM Pipeline",
          "cs210-playlist-lambda",
          "dice-roll-api"
        ],
        "3": [
          "Ask Barry",
          "SECOM Pipeline"
        ],
        "4": [
          "Ask Barry",
          "SECOM Pipeline"
        ]
      },
      "evidence": [
        {
          "tier": 4,
          "repo": "ask-barry",
          "path": "docs/azure-setup.md",
          "heading": "Stage 3: Azure setup > Step 7: Verify",
          "url": "https://github.com/BBSISK/ask-barry/blob/9945cdc95432766ebb35365092c879f07a297f72/docs/azure-setup.md#step-7-verify",
          "project": "Ask Barry",
          "source_type": "github_readme",
          "verified_by": "self",
          "quote": "PASS Azure OpenAI embeddings: 1536-dimension vector PASS Azure OpenAI chat: model replied 'ready' PASS Azure AI Search: reachable, 0 index(es) so far",
          "kind": "application",
          "first_committed": "2026-09-27"
        },
        {
          "tier": 4,
          "repo": "ask-barry",
          "path": "docs/azure-setup.md",
          "heading": "Stage 3: Azure setup > Step 8: Sign in with Entra ID instead of keys (ASK-8)",
          "url": "https://github.com/BBSISK/ask-barry/blob/ca09d2ec90427f5eb3fc19d873ed72e53449ce1b/docs/azure-setup.md#step-8-sign-in-with-entra-id-instead-of-keys-ask-8",
          "project": "Ask Barry",
          "source_type": "github_readme",
          "verified_by": "self",
          "quote": "Try it locally. In `.env` set `AZURE_AUTH_MODE=entra` and comment out both keys, then run `python -m scripts.check_azure`. New role assignments can take 5–10 minutes to apply; a `401`/`403` straight after `apply` usually just means wait.",
          "kind": "application",
          "first_committed": "2026-09-27"
        },
        {
          "tier": 4,
          "repo": "SECOM_Pipeline",
          "path": "README.md",
          "heading": "SECOM Semiconductor Pipeline > Security",
          "url": "https://github.com/BBSISK/SECOM_Pipeline/blob/df3999c92d652a213ef60392373e6a2bb2fd9db6/README.md#security",
          "project": "SECOM Pipeline",
          "source_type": "github_readme",
          "verified_by": "self",
          "quote": "Shift-left security gate on every pull request. Ruff's Bandit (`S`) rules, pip-audit, a Trivy config scan of the Terraform and Dockerfile, Hadolint, and a Trivy image scan all run inside the required CI checks",
          "kind": "application",
          "first_committed": "2026-10-11"
        },
        {
          "tier": 3,
          "repo": "ask-barry",
          "path": "README.md",
          "heading": "Ask Barry > Azure and AWS Bedrock compared (Stage 10)",